{
  "$schema": "http://json-schema.org/draft-07/schema#",
  "title": "IPsec pcap ground-truth label",
  "description": "Ground truth attached to every pcap produced by the M2 testbed. Per-variant fields are derived from testbed/matrix.py; per-pcap fields (traffic_type, source, run_id, duration_s, packet_count) are attached by the capture manifest. 'variant': plain marks non-IPsec negatives, whose remaining IPsec fields are all none/0/false.",
  "type": "object",
  "required": [
    "variant",
    "ipsec_protocol",
    "ike_version",
    "mode",
    "encryption",
    "key_length_bits",
    "auth",
    "aead",
    "dh_group",
    "pfs",
    "ike_encryption",
    "ike_key_length_bits",
    "ike_auth",
    "ike_dh_group",
    "esn",
    "replay_window",
    "nat_t",
    "ike_rekey_s",
    "child_rekey_s",
    "ip_version",
    "traffic_type",
    "source",
    "run_id",
    "duration_s",
    "packet_count"
  ],
  "additionalProperties": false,
  "properties": {
    "variant": {
      "description": "Variant id from testbed/matrix.py, or 'plain' for non-IPsec negatives.",
      "type": "string",
      "pattern": "^(v([1-9]|1[0-9]|2[01])|plain)$"
    },
    "ipsec_protocol": {
      "description": "IPsec protocol of the CHILD SA (labelled on the wire as IP proto 50/51).",
      "type": "string",
      "enum": ["esp", "ah", "none"]
    },
    "ike_version": {
      "description": "IKE version used by this variant's IKE SA.",
      "type": "string",
      "enum": ["ikev1", "ikev2", "none"]
    },
    "mode": {
      "description": "IPsec mode of the CHILD SA.",
      "type": "string",
      "enum": ["tunnel", "transport", "none"]
    },
    "encryption": {
      "description": "Encryption algorithm of the CHILD SA ('none' for AH and negatives). The IKE SA suite is labelled separately (ike_encryption).",
      "type": "string",
      "enum": [
        "aes-128-cbc",
        "aes-256-cbc",
        "aes-128-gcm",
        "aes-256-gcm",
        "3des-cbc",
        "none"
      ]
    },
    "key_length_bits": {
      "description": "Symmetric key length in bits (168 = 3DES effective key size; 0 = none).",
      "type": "integer",
      "enum": [0, 128, 168, 256]
    },
    "auth": {
      "description": "Integrity algorithm of the CHILD SA ('aead' when integrity is provided by the AEAD cipher, 'none' for negatives). The IKE SA suite is labelled separately (ike_auth).",
      "type": "string",
      "enum": ["hmac-sha256", "hmac-sha1", "aead", "none"]
    },
    "aead": {
      "description": "True when the cipher provides authentication itself (GCM family).",
      "type": "boolean"
    },
    "dh_group": {
      "description": "CHILD SA PFS group (2/5 weak, 14/19/20 modern; 0 = negatives). The IKE SA group is labelled separately (ike_dh_group); the two are identical except on mismatch variants.",
      "type": "integer",
      "enum": [0, 2, 5, 14, 19, 20]
    },
    "ike_encryption": {
      "description": "Encryption algorithm of the IKE SA (may differ from the CHILD suite on mismatch variants).",
      "type": "string",
      "enum": [
        "aes-128-cbc",
        "aes-256-cbc",
        "aes-128-gcm",
        "aes-256-gcm",
        "3des-cbc",
        "none"
      ]
    },
    "ike_key_length_bits": {
      "description": "IKE SA symmetric key length in bits (0 = negatives).",
      "type": "integer",
      "enum": [0, 128, 168, 256]
    },
    "ike_auth": {
      "description": "Integrity/PRF base of the IKE SA ('aead' for GCM suites, 'none' for negatives).",
      "type": "string",
      "enum": ["hmac-sha256", "hmac-sha1", "aead", "none"]
    },
    "ike_dh_group": {
      "description": "DH group of the IKE SA (in the clear IKE_SA_INIT KE payload).",
      "type": "integer",
      "enum": [0, 2, 5, 14, 19, 20]
    },
    "pfs": {
      "description": "Perfect forward secrecy: a DH group appears in the CHILD SA proposal (applied at CREATE_CHILD_SA rekey for IKEv2, first quick mode for IKEv1).",
      "type": "boolean"
    },
    "esn": {
      "description": "Extended sequence numbers on the CHILD SA (kernel XFRM_STATE_ESN).",
      "type": "boolean"
    },
    "replay_window": {
      "description": "XFRM replay window size in packets; 0 = replay protection disabled.",
      "type": "integer",
      "enum": [0, 32]
    },
    "nat_t": {
      "description": "ESP-in-UDP encapsulation enforced (swanctl encap=yes / ipsec.conf forceencaps=yes).",
      "type": "boolean"
    },
    "ike_rekey_s": {
      "description": "IKE SA rekey interval in seconds (0 = negatives).",
      "type": "integer",
      "minimum": 0
    },
    "child_rekey_s": {
      "description": "CHILD SA rekey interval in seconds (0 = negatives).",
      "type": "integer",
      "minimum": 0
    },
    "ip_version": {
      "description": "IP version of the protected traffic and IKE exchange (4 or 6; also set for negatives).",
      "type": "integer",
      "enum": [4, 6]
    },
    "traffic_type": {
      "description": "Synthetic traffic profile mixed into this capture (spec M2 set).",
      "type": "string",
      "enum": ["voip", "video", "web", "email", "whatsapp", "icmp"]
    },
    "source": {
      "description": "'real' = captured from a live testbed, 'synthetic' = generated by synth_pcap.py (never mix the two in one training split without declaring it).",
      "type": "string",
      "enum": ["real", "synthetic"]
    },
    "run_id": {
      "description": "Capture run identifier; group key for train/test splits (splits must be grouped by run, decision D6).",
      "type": "string",
      "minLength": 1,
      "pattern": "^[A-Za-z0-9._-]+$"
    },
    "duration_s": {
      "description": "Capture duration in seconds.",
      "type": "number",
      "exclusiveMinimum": 0
    },
    "packet_count": {
      "description": "Total packets in the pcap.",
      "type": "integer",
      "minimum": 1
    }
  },
  "allOf": [
    {
      "if": {
        "properties": {"encryption": {"enum": ["aes-128-gcm", "aes-256-gcm"]}},
        "required": ["encryption"]
      },
      "then": {
        "properties": {
          "aead": {"const": true},
          "auth": {"const": "aead"}
        }
      }
    },
    {
      "if": {
        "properties": {
          "encryption": {"enum": ["aes-128-cbc", "aes-256-cbc", "3des-cbc", "none"]}
        },
        "required": ["encryption"]
      },
      "then": {
        "properties": {"aead": {"const": false}}
      }
    },
    {
      "if": {
        "properties": {"variant": {"const": "plain"}},
        "required": ["variant"]
      },
      "then": {
        "properties": {
          "ipsec_protocol": {"const": "none"},
          "ike_version": {"const": "none"},
          "mode": {"const": "none"},
          "encryption": {"const": "none"},
          "key_length_bits": {"const": 0},
          "auth": {"const": "none"},
          "aead": {"const": false},
          "dh_group": {"const": 0},
          "pfs": {"const": false},
          "ike_encryption": {"const": "none"},
          "ike_key_length_bits": {"const": 0},
          "ike_auth": {"const": "none"},
          "ike_dh_group": {"const": 0},
          "esn": {"const": false},
          "replay_window": {"const": 0},
          "nat_t": {"const": false},
          "ike_rekey_s": {"const": 0},
          "child_rekey_s": {"const": 0}
        }
      }
    },
    {
      "if": {
        "properties": {"ipsec_protocol": {"const": "ah"}},
        "required": ["ipsec_protocol"]
      },
      "then": {
        "properties": {
          "encryption": {"const": "none"},
          "key_length_bits": {"const": 0},
          "aead": {"const": false}
        }
      }
    },
    {
      "if": {
        "properties": {"encryption": {"const": "none"}},
        "required": ["encryption"]
      },
      "then": {
        "properties": {"ipsec_protocol": {"enum": ["ah", "none"]}}
      }
    },
    {
      "if": {
        "properties": {"ipsec_protocol": {"const": "none"}},
        "required": ["ipsec_protocol"]
      },
      "then": {
        "properties": {"variant": {"const": "plain"}}
      }
    }
  ]
}
